{
  "$schema": "urn:watchtower:schema:artifacts:plan:initiative-event-stream:v1",
  "event_id": "event.watchtower_ctf_implementation_package_preservation.0019_authored_inputs_confirmed",
  "initiative_id": "initiative.watchtower_ctf_implementation_package_preservation",
  "sequence": 19,
  "event_type": "authored_inputs_confirmed",
  "actor_id": "actor.repository_maintainer",
  "recorded_at": "2026-03-27T15:10:35Z",
  "summary": "An authorized maintainer confirmed the authored intake documents into machine state.",
  "payload": {},
  "trace_id": "trace.watchtower_ctf_implementation_package_preservation"
}
