{
  "$schema": "urn:watchtower:schema:artifacts:plan:initiative-event-stream:v1",
  "event_id": "event.watchtower_status_snapshot.0009_authored_inputs_confirmed",
  "initiative_id": "initiative.watchtower_status_snapshot",
  "trace_id": "trace.watchtower_status_snapshot",
  "sequence": 9,
  "event_type": "authored_inputs_confirmed",
  "actor_id": "actor.repository_maintainer",
  "recorded_at": "2026-03-17T07:54:22Z",
  "summary": "An authorized maintainer confirmed the authored intake documents into machine state.",
  "payload": {}
}
