{
  "$schema": "urn:watchtower:schema:artifacts:plan:initiative-event-stream:v1",
  "event_id": "event.plan_event_stream_helper_foundation.0006_closeout_shell_seeded",
  "initiative_id": "initiative.plan_event_stream_helper_foundation",
  "trace_id": "trace.plan_event_stream_helper_foundation",
  "sequence": 6,
  "event_type": "closeout_shell_seeded",
  "actor_id": "actor.watchtower_core",
  "recorded_at": "2026-03-17T21:18:11Z",
  "summary": "Seeded the closeout shell.",
  "related_paths": [
    "plan/initiatives/plan_event_stream_helper_foundation/initiative_brief.md",
    "plan/initiatives/plan_event_stream_helper_foundation/design_record.md",
    "plan/initiatives/plan_event_stream_helper_foundation/implementation_slice.md",
    "plan/initiatives/plan_event_stream_helper_foundation/decision_notes.md"
  ],
  "payload": {
    "task_count": 3
  }
}
