{
  "$schema": "urn:watchtower:schema:artifacts:plan:initiative-event-stream:v1",
  "event_id": "event.plan_actor_registry_and_runtime_boundary_reconciliation.0003_authored_inputs_confirmed",
  "initiative_id": "initiative.plan_actor_registry_and_runtime_boundary_reconciliation",
  "sequence": 3,
  "event_type": "authored_inputs_confirmed",
  "actor_id": "actor.watchtower_core",
  "recorded_at": "2026-03-17T23:45:40Z",
  "summary": "Confirmed the authored intake documents into machine state.",
  "payload": {
    "task_count": 3
  },
  "trace_id": "trace.plan_actor_registry_and_runtime_boundary_reconciliation",
  "related_paths": [
    "plan/initiatives/plan_actor_registry_and_runtime_boundary_reconciliation/initiative_brief.md",
    "plan/initiatives/plan_actor_registry_and_runtime_boundary_reconciliation/design_record.md",
    "plan/initiatives/plan_actor_registry_and_runtime_boundary_reconciliation/implementation_slice.md"
  ]
}
