{
  "$schema": "urn:watchtower:schema:artifacts:plan:initiative-event-stream:v1",
  "event_id": "event.plan_task_authority_rendering_governance_recovery.0010_ready_for_execution_approved",
  "initiative_id": "initiative.plan_task_authority_rendering_governance_recovery",
  "sequence": 10,
  "event_type": "ready_for_execution_approved",
  "actor_id": "actor.repository_maintainer",
  "recorded_at": "2026-03-18T19:50:41Z",
  "summary": "An authorized maintainer approved the initiative package for execution.",
  "payload": {},
  "trace_id": "trace.plan_task_authority_rendering_governance_recovery"
}
