{
  "$schema": "urn:watchtower:schema:artifacts:plan:initiative-event-stream:v1",
  "event_id": "event.plan_requirements_decisions_adherence_remediation.0007_promotion_shell_seeded",
  "initiative_id": "initiative.plan_requirements_decisions_adherence_remediation",
  "sequence": 7,
  "event_type": "promotion_shell_seeded",
  "actor_id": "actor.watchtower_core",
  "recorded_at": "2026-03-19T15:58:30Z",
  "summary": "Seeded the promotion shell.",
  "payload": {
    "task_count": 1
  },
  "trace_id": "trace.plan_requirements_decisions_adherence_remediation",
  "related_paths": [
    "plan/initiatives/plan_requirements_decisions_adherence_remediation/initiative_brief.md",
    "plan/initiatives/plan_requirements_decisions_adherence_remediation/design_record.md",
    "plan/initiatives/plan_requirements_decisions_adherence_remediation/implementation_slice.md",
    "plan/initiatives/plan_requirements_decisions_adherence_remediation/decision_notes.md"
  ]
}
