{
  "$schema": "urn:watchtower:schema:artifacts:plan:initiative-event-stream:v1",
  "event_id": "event.watchtower_work_item_begin_flow.0011_ready_for_execution_marked",
  "initiative_id": "initiative.watchtower_work_item_begin_flow",
  "trace_id": "trace.watchtower_work_item_begin_flow",
  "sequence": 11,
  "event_type": "ready_for_execution_marked",
  "actor_id": "actor.watchtower_core",
  "recorded_at": "2026-03-17T08:39:58Z",
  "summary": "The initiative package entered ready_for_execution after approval.",
  "payload": {}
}
