{
  "$schema": "urn:watchtower:schema:artifacts:plan:initiative-event-stream:v1",
  "event_id": "event.plan_duplicated_foundations_corpus_bootstrap.0007_promotion_shell_seeded",
  "initiative_id": "initiative.plan_duplicated_foundations_corpus_bootstrap",
  "trace_id": "trace.plan_duplicated_foundations_corpus_bootstrap",
  "sequence": 7,
  "event_type": "promotion_shell_seeded",
  "actor_id": "actor.watchtower_core",
  "recorded_at": "2026-03-17T19:15:00Z",
  "summary": "Seeded the promotion shell.",
  "related_paths": [
    "plan/initiatives/plan_duplicated_foundations_corpus_bootstrap/initiative_brief.md",
    "plan/initiatives/plan_duplicated_foundations_corpus_bootstrap/design_record.md",
    "plan/initiatives/plan_duplicated_foundations_corpus_bootstrap/implementation_slice.md",
    "plan/initiatives/plan_duplicated_foundations_corpus_bootstrap/decision_notes.md"
  ],
  "payload": {
    "task_count": 3
  }
}
