{
  "$schema": "urn:watchtower:schema:artifacts:plan:initiative-event-stream:v1",
  "event_id": "event.repository_validation_repair_loop_closeout.0011_ready_for_review_marked",
  "initiative_id": "initiative.repository_validation_repair_loop_closeout",
  "sequence": 11,
  "event_type": "ready_for_review_marked",
  "actor_id": "actor.watchtower_core",
  "recorded_at": "2026-03-23T05:22:55Z",
  "summary": "The initiative package passed capture validation and is ready for review.",
  "payload": {},
  "trace_id": "trace.repository_validation_repair_loop_closeout"
}
