{
  "$schema": "urn:watchtower:schema:artifacts:plan:initiative-event-stream:v1",
  "event_id": "event.plan_terminology_helper_foundation.0009_authored_inputs_confirmed",
  "initiative_id": "initiative.plan_terminology_helper_foundation",
  "sequence": 9,
  "event_type": "authored_inputs_confirmed",
  "actor_id": "actor.repository_maintainer",
  "recorded_at": "2026-03-18T00:46:22Z",
  "summary": "An authorized maintainer confirmed the authored intake documents into machine state.",
  "payload": {},
  "trace_id": "trace.plan_terminology_helper_foundation"
}
