{
  "$schema": "urn:watchtower:schema:artifacts:plan:initiative-event-stream:v1",
  "event_id": "event.plan_task_tracking_sync_performance.0008_ready_for_review_marked",
  "initiative_id": "initiative.plan_task_tracking_sync_performance",
  "sequence": 8,
  "event_type": "ready_for_review_marked",
  "actor_id": "actor.watchtower_core",
  "recorded_at": "2026-03-22T16:43:37Z",
  "summary": "The initiative package passed capture validation and is ready for review.",
  "payload": {},
  "trace_id": "trace.plan_task_tracking_sync_performance"
}
