{
  "$schema": "urn:watchtower:schema:artifacts:plan:initiative-event-stream:v1",
  "event_id": "event.core_shared_language_deplanification.0002_scope_defined",
  "initiative_id": "initiative.core_shared_language_deplanification",
  "sequence": 2,
  "event_type": "scope_defined",
  "actor_id": "actor.watchtower_core",
  "recorded_at": "2026-03-22T14:53:23Z",
  "summary": "Recorded the initial pack-wide initiative scope.",
  "payload": {
    "task_count": 1
  },
  "trace_id": "trace.core_shared_language_deplanification",
  "related_paths": [
    "plan/initiatives/core_shared_language_deplanification/initiative_brief.md",
    "plan/initiatives/core_shared_language_deplanification/design_record.md",
    "plan/initiatives/core_shared_language_deplanification/implementation_slice.md",
    "plan/initiatives/core_shared_language_deplanification/decision_notes.md"
  ]
}
