{
  "$schema": "urn:watchtower:schema:artifacts:plan:initiative-event-stream:v1",
  "event_id": "event.root_pack_schema_catalog_contract_alignment.0013_ready_for_execution_marked",
  "initiative_id": "initiative.root_pack_schema_catalog_contract_alignment",
  "sequence": 13,
  "event_type": "ready_for_execution_marked",
  "actor_id": "actor.watchtower_core",
  "recorded_at": "2026-03-22T23:00:04Z",
  "summary": "The initiative package entered ready_for_execution after approval.",
  "payload": {},
  "trace_id": "trace.root_pack_schema_catalog_contract_alignment"
}
