{
  "$schema": "urn:watchtower:schema:artifacts:plan:initiative-event-stream:v1",
  "event_id": "event.plan_legacy_history_retention_reconciliation.0002_scope_defined",
  "initiative_id": "initiative.plan_legacy_history_retention_reconciliation",
  "trace_id": "trace.plan_legacy_history_retention_reconciliation",
  "sequence": 2,
  "event_type": "scope_defined",
  "actor_id": "actor.watchtower_core",
  "recorded_at": "2026-03-17T09:26:17Z",
  "summary": "Recorded the initial pack-wide initiative scope.",
  "related_paths": [
    "plan/initiatives/plan_legacy_history_retention_reconciliation/initiative_brief.md",
    "plan/initiatives/plan_legacy_history_retention_reconciliation/design_record.md",
    "plan/initiatives/plan_legacy_history_retention_reconciliation/implementation_slice.md",
    "plan/initiatives/plan_legacy_history_retention_reconciliation/decision_notes.md"
  ],
  "payload": {
    "task_count": 3
  }
}
