{
  "$schema": "urn:watchtower:schema:artifacts:plan:initiative-event-stream:v1",
  "event_id": "event.runtime_telemetry_and_command_observability_foundation.0010_authored_inputs_confirmed",
  "initiative_id": "initiative.runtime_telemetry_and_command_observability_foundation",
  "sequence": 10,
  "event_type": "authored_inputs_confirmed",
  "actor_id": "actor.repository_maintainer",
  "recorded_at": "2026-03-22T17:38:21Z",
  "summary": "An authorized maintainer confirmed the authored intake documents into machine state.",
  "payload": {},
  "trace_id": "trace.runtime_telemetry_and_command_observability_foundation"
}
